### ISSUE TITLE
[GCP] LoadBalancer Health Checks are failing

### ISSUE THREAD

**Issue by vpnachev** [gardenlinux/gardenlinux#47]
**What happened**:
For k8s services of type LoadBalancer GCP creates health checks for the backing nodes.
With Garden Linux version 11.29.1 these health checks are failing
```log
Instance shoot--foo--bar-cpu-worker-z1-123-456 is unhealthy for <public-ip>.
```

**What you expected to happen**:
Health checks to not fail.

**How to reproduce it (as minimally and precisely as possible)**:
Create a shoot cluster with Garden Linux and a service of type Load Balancer.
Check in the GCP console that the health checks are failing for this Load Balancer.  

**Anything else we need to know**:
Although the health checks are failing, some services are still working, but others are not accessible.

**Environment**:

**Comment by vpnachev** [comment]
After some more investigation, it turns out that services with `externalTrafficPolicy: Cluster` are not affected, but those with `externalTrafficPolicy: Local` are broken.

**Comment by marwinski** [comment]
Well spotted @vpnachev! I don't yet know the root cause but this is what tcpdump shows:

These are the health checks where the SYNs are dropped (the domain yields to the public IP), so the load balancer marks the node unhealthy:
```
18:05:25.316357 IP 169.254.169.254.35308 > 144.152.195.35.bc.googleusercontent.com.32708: Flags [S], seq 557443286, win 62920, options [mss 1430,sackOK,TS val 2621715280 ecr 0,nop,wscale 8], length 0
18:05:25.614224 IP 169.254.169.254.35309 > 144.152.195.35.bc.googleusercontent.com.32708: Flags [S], seq 3260391361, win 62920, options [mss 1430,sackOK,TS val 2355643521 ecr 0,nop,wscale 8], length 0
8:08
```

This is a http request from my laptop which is successful when it hits the correct node:
```
8:05:25.008014 IP 193.16.224.12.12872 > 144.152.195.35.bc.googleusercontent.com.http: Flags [S], seq 2495233926, win 4032, options [mss 1344,nop,nop,TS val 3858992804 ecr 0,sackOK,eol], length 0
18:05:25.021015 IP 193.16.224.12.12872 > 144.152.195.35.bc.googleusercontent.com.http: Flags [.], ack 1, win 4032, options [nop,nop,TS val 3858992817 ecr 3619430776], length 0
18:05:25.021780 IP 193.16.224.12.12872 > 144.152.195.35.bc.googleusercontent.com.http: Flags [P.], seq 1:79, ack 1, win 4032, options [nop,nop,TS val 3858992817 ecr 3619430776], length 78: HTTP: GET / HTTP/1.1
8:09
...
```

First observation: this cannot work. The health check needs to go to the node and not to the pod. There is no rule to forward port 32708 to the pod - it must be forwarded to the node.

**Comment by marwinski** [comment]
OK, here is more of the story: 

The node should know that it needs to accept packets for the external local balancer address. This works fine on a different OS, e.g. ```curl <external ip>:<healch check port>``` run on the node returns the health check result. This does not work on Garden Linux. 

Unfortunately there is hardly any usable information out here. What are he IP addresses that a host accepts? The usual stuff like ```ip addr```, ```ip route``` etc. does not yield anything. Thanks to some references on stackoverflow I found this:

```
/proc/net/fib_trie
```

The external ip address in question is listed there.

This led to a comprehensive article on ```ip route```: http://linux-ip.net/html/tools-ip-route.html. ```ip route show table local``` finally shows the reason it works (and does not work on Garden Linux).

```
# ip route show table local
[...]
local <external ip> dev ens4v1 proto 66 scope host
[...]
```

Manually adding this entry to a Garden Linux node fixes the problem:

```
ip route add table local local <external ip> dev ens4 proto 66 scope host
```

Question is why this route is not propagated in the first place.

**Comment by vpnachev** [comment]
Fixed by https://github.com/gardenlinux/gardenlinux/commit/ad1a05e15fcdac3739a7fc22a03b88309cf6523d

**Comment by marwinski** [comment]
Fixed with https://github.com/gardenlinux/gardenlinux/commit/ad1a05e15fcdac3739a7fc22a03b88309cf6523d
